feedback_id,cst_id,feedback_text,feedback_date,rating
1,122,Training necessary drug than my fear election.,08-08-2024,3
2,411,Commercial will none book road trouble policy issue.,21-08-2023,1
3,70,Chance test different one trouble tonight voice campaign.,19-03-2024,4
4,185,,14-07-2023,4
5,491,Determine value church employee consider floor discuss age.,01-10-2023,3
6,16,Tell knowledge way the.,01-08-2023,4
7,,Budget compare physical factor skill when.,15-04-2025,5
8,310,Fund enter director nearly economic close.,21-06-2025,5
9,31,Notice story either.,25-05-2024,4
10,125,,06-06-2025,6
11,490,Civil rich price seem feeling measure skill.,05-01-2025,5
12,495,Method plant hot suddenly on similar lead.,12-01-2025,6
13,,,23-09-2023,0
14,111,Chair trouble light class.,20-04-2024,6
15,46,Wind hit everybody third.,21-10-2023,2
16,399,Wear significant evening some able why represent.,07-10-2023,2
17,,Civil now perhaps.,14-06-2024,3
18,83,Grow treat control weight who.,26-10-2023,3
19,105,Beat actually tree town.,15-04-2025,0
20,195,Hotel him own successful month.,08-07-2024,4
21,381,Several able join so truth least.,31-01-2024,1
22,453,,21-10-2023,6
23,200,Why population maintain one meet short save they.,21-07-2023,4
24,96,Test sing PM happy great they begin.,07-08-2023,4
25,412,Site more need resource meeting down.,09-07-2024,2
26,162,Run our world follow view clearly herself store.,30-11-2024,0
27,364,Those lawyer down authority suggest interesting.,09-08-2023,1
28,381,,NA,6
29,58,Successful year thousand.,28-03-2024,2
30,57,Thus activity read clear lot interview since play.,13-10-2024,6
31,281,Want speech modern loss dinner employee executive.,10-10-2023,6
32,494,Size claim face which brother common finally.,23-08-2024,0
33,428,Size pick minute nothing sing.,04-08-2024,2
34,,Officer suddenly provide assume cut possible.,11-02-2024,1
35,126,Learn politics know deal entire home sport.,30-06-2024,3
36,75,Likely response issue too.,01-04-2024,3
37,389,Fire set factor ready.,24-10-2023,3
38,439,List because time heavy tough admit cut bring.,23-03-2025,0
39,463,Let while his so southern game respond alone.,06-12-2024,1
40,185,Church business certainly account.,14-12-2023,0
41,332,Later career develop say much white.,12-02-2025,6
42,74,Industry street write agency government.,02-06-2025,6
43,110,Whatever consider success take than.,24-09-2023,3
44,139,Image rest measure more.,11-09-2023,4
45,73,,23-01-2024,0
46,468,Much answer another during else total white door.,28-10-2023,1
47,374,Reflect surface traditional response benefit democratic red.,03-04-2024,3
48,,Up point political then recognize fill.,06-09-2024,2
49,380,Teach expect door tell just though.,17-05-2025,0
50,409,Color network them way land later.,19-01-2024,1
51,453,Unit pressure dinner its.,03-01-2024,5
52,316,Total almost be see.,14-07-2024,4
53,,Expert five great his road summer standard.,11-05-2025,5
54,216,Region water performance anyone next floor sport.,29-04-2024,5
55,181,Citizen news production argue often box.,28-02-2025,0
56,116,I real though rise.,21-05-2024,0
57,241,What center recently bill like around.,14-03-2025,2
58,334,Positive red effect approach think.,27-11-2024,5
59,419,Guess similar really.,24-03-2024,3
60,286,Window forward green practice although.,26-03-2025,0
61,,Song focus really attack decade avoid.,04-04-2025,6
62,69,Positive question hotel road speak relate.,NA,3
63,177,Oil high practice war type policy phone.,22-02-2024,3
64,184,Easy meeting what bank fish save.,NA,1
65,180,Probably itself benefit.,13-04-2024,3
66,19,Behavior question Mr pay sing husband economic.,10-12-2024,3
67,55,Really spring station organization entire again staff.,30-01-2024,5
68,57,Between language read manage young expect thing get.,NA,5
69,477,Seek order international nearly son.,28-08-2023,2
70,473,Rich at those house mother.,11-08-2024,1
71,88,Or six early charge.,28-12-2023,1
72,277,Star bank moment wrong design some just.,NA,3
73,388,Condition how everything gun.,18-02-2024,1
74,376,Strategy again within attorney PM.,03-12-2024,3
75,275,Idea focus person alone professor total candidate.,29-07-2024,4
76,131,Bar meet pattern purpose.,27-06-2025,1
77,220,Represent face test tend.,29-12-2024,0
78,466,Arrive others instead important.,18-08-2024,0
79,346,Which law major recognize every.,21-06-2024,1
80,110,Around play probably contain science hair soldier food.,18-01-2024,6
81,31,Commercial tough production land view.,15-05-2025,2
82,257,Push father if whose get administration sign.,17-12-2023,2
83,160,Light condition positive course.,30-07-2023,0
84,13,Morning two discuss activity lose.,14-11-2023,6
85,119,Simply list better lot movie tax appear.,30-04-2024,3
86,337,Best employee pull song record represent on.,06-11-2023,6
87,46,Long us factor sit gas stock writer thank.,04-05-2025,1
88,57,Onto sport into ahead truth resource.,17-06-2025,2
89,252,Including official paper own when culture.,10-02-2024,4
90,434,Avoid today term present peace.,05-01-2025,5
91,44,Look put cost garden suggest.,NA,4
92,23,Necessary send network article four.,24-12-2024,1
93,293,,18-10-2024,3
94,392,,11-09-2023,0
95,422,Cover race central because wall evidence surface serious.,06-07-2025,6
96,483,Democrat hold join interesting.,03-02-2025,4
97,202,Job phone one police player director all.,09-03-2025,6
98,374,Staff item grow business itself budget.,10-11-2024,6
99,427,Your event marriage just despite hand from.,15-07-2024,5
100,167,,25-06-2024,5
101,143,Social hear find.,10-11-2023,1
102,262,Help leave concern player need ball create everything.,05-10-2024,0
103,230,Civil call finish avoid reduce particular.,07-07-2025,1
104,21,Clearly nothing effect play.,12-06-2025,5
105,61,Soon radio successful while area.,21-03-2025,0
106,495,Even could reveal interesting above thus degree.,28-09-2024,4
107,164,Score later huge politics lose.,20-12-2023,6
108,96,Wall story behind product every add system.,19-06-2025,4
109,439,Team day news kind seat.,13-08-2023,5
110,,Heavy cold get enough its know wind.,21-04-2024,4
111,86,Evening house law all president suddenly.,12-06-2025,5
112,373,Animal fill author process line particular fine.,29-01-2025,1
113,481,Study need another somebody agree law do consider.,04-11-2023,6
114,444,Laugh often must worker large believe high long.,24-03-2025,2
115,,Word usually marriage system outside wrong present.,09-06-2024,2
116,1,,01-02-2024,0
117,390,Another listen happen small at business everything trial.,26-08-2023,3
118,32,Minute include young something various history.,23-09-2023,6
119,,Physical lay foot entire possible then.,09-09-2024,6
120,193,Sure address career bring these.,20-06-2024,0
121,150,Good development cut eight.,31-12-2023,3
122,207,Best difference card.,01-01-2024,3
123,304,Pull relationship day.,26-02-2025,4
124,3,Improve could current threat maintain though.,01-01-2025,5
125,,During result little whatever space body understand.,10-03-2025,3
126,394,Exist public situation effort throw government.,08-08-2024,3
127,47,Number car red work turn offer first would.,16-07-2023,4
128,61,We soldier nature member paper.,04-04-2024,4
129,2,Bank fund event thought.,29-06-2025,5
130,,,11-11-2023,6
131,436,,20-01-2025,3
132,291,Note nothing involve reach.,03-12-2023,1
133,322,Reality fill eight war interest gun.,24-12-2024,6
134,121,Opportunity pick trade reality.,26-10-2024,2
135,254,Get up quickly civil.,18-02-2024,6
136,234,Position instead rate.,18-08-2024,6
137,298,Pick experience allow suddenly.,17-12-2024,4
138,484,Race moment economy along sure father.,21-02-2025,0
139,373,Sing above father trade on agreement price recently.,24-01-2024,6
140,367,,07-02-2025,4
141,199,Evidence walk everyone put two require.,10-11-2023,3
142,,Contain away force or bit south particular.,18-02-2025,6
143,173,Region much agreement ever subject.,11-11-2023,1
144,432,Store military away nor draw all.,07-05-2025,1
145,483,Remain already its piece break meet.,16-11-2024,4
146,466,,22-10-2023,2
147,246,Skin tax able property audience.,13-07-2023,2
148,199,Foot everybody nor risk leader.,04-07-2025,5
149,26,,30-08-2024,3
150,,Eight attack ten much once.,10-09-2024,4
151,431,,29-08-2024,2
152,264,Spend road Democrat do project better.,20-12-2023,6
153,113,Land company follow eye attack say offer social.,10-02-2025,4
154,61,Short these month return five one walk ability.,08-12-2023,5
155,371,,15-01-2024,0
156,488,Eight someone group offer base through when.,12-01-2024,2
157,476,Life on here art involve.,17-11-2024,6
158,452,Model company color end young red.,27-01-2025,1
159,48,Certain crime case.,26-02-2025,3
160,285,Star church raise boy blue letter.,20-05-2024,5
161,356,,31-08-2024,4
162,257,Ground describe whatever show easy.,11-12-2024,3
163,294,,NA,4
164,159,Must no front that beyond front make.,18-03-2025,0
165,10,Future series truth agent choose rest short bring.,23-12-2024,2
166,134,Relationship dog hit letter.,10-06-2024,5
167,341,Focus with statement.,30-05-2025,0
168,,Call thus thank pattern player effort would.,08-07-2025,0
169,166,Event range smile magazine institution dark.,07-01-2024,2
170,143,Clear however who start firm current however.,29-08-2023,0
171,16,Food number second watch history thousand anyone.,16-06-2024,4
172,193,Part leg say economic within item process mouth.,04-09-2023,2
173,311,Serious arrive response human.,14-11-2023,1
174,146,Want can put.,24-03-2025,5
175,361,Clear who evidence him.,11-02-2024,4
176,208,Machine politics clearly role.,12-11-2023,5
177,76,Local into bit exactly.,18-09-2024,6
178,49,Nearly stop study material.,23-08-2024,0
179,71,Example threat institution interest scientist.,26-10-2024,2
180,330,Radio audience nature.,29-02-2024,0
181,415,Agent wait kid respond.,24-04-2025,1
182,395,Respond city even control form.,27-02-2024,2
183,47,Likely standard always pay.,19-09-2024,5
184,78,Down sort while eye.,23-06-2025,6
185,335,Teach service they still per ten you whose.,08-08-2023,1
186,229,Woman me admit suggest.,15-04-2025,3
187,393,Discuss media pick with science.,08-07-2024,5
188,1,Range court wear win region you.,27-09-2024,3
189,457,Song involve ask chance certain site.,01-06-2024,0
190,18,Discover role drop finish.,22-11-2024,0
191,257,Argue hold TV join effort wait.,08-12-2023,3
192,255,Loss find environment seem goal beyond.,13-10-2023,0
193,167,,18-12-2023,2
194,240,Professional a computer short.,25-02-2025,6
195,468,Real throw work great beyond.,15-08-2023,2
196,498,Memory another be about herself range cold.,15-09-2024,2
197,160,,08-07-2025,2
198,477,Measure quality north.,21-10-2024,3
199,233,Serious tax professor into.,24-07-2023,1
200,,Record table recognize item responsibility.,18-04-2024,4
201,82,Anyone industry international road management morning approach.,19-02-2025,6
202,396,People turn better grow range.,09-07-2024,0
203,72,,17-01-2024,3
204,170,Black sign such agent over suddenly.,05-06-2025,1
205,60,Together happen common of conference continue.,20-12-2023,5
206,481,Data science whose certain almost.,24-06-2024,3
207,91,To room accept seem item.,13-03-2025,0
208,499,Mrs involve particularly feel.,01-06-2025,0
209,290,,18-08-2023,3
210,,Nature game reach involve kid.,29-10-2024,5
211,457,Along cold third remain religious if line.,04-05-2025,2
212,453,Our close mission.,24-04-2024,5
213,,Still gun radio weight.,22-11-2023,4
214,89,Right officer star particularly identify soon.,06-10-2024,6
215,136,Red near drop individual store human perform.,12-09-2024,4
216,13,Never throw remember specific.,15-09-2024,1
217,66,Fish detail camera idea court sit ever natural.,30-07-2023,4
218,268,Hotel marriage range pay factor.,30-09-2023,2
219,45,Care nice relate yeah.,25-10-2023,3
220,,Five hope drop.,27-07-2024,3
221,382,Through involve movie support him both.,31-05-2025,6
222,103,Foot nice ok make evidence society base.,11-01-2024,4
223,66,Performance detail better machine report edge.,16-02-2024,6
224,474,Travel summer blue heavy simple.,05-04-2025,4
225,36,,09-07-2025,0
226,65,,26-01-2024,3
227,,Increase something risk I per four hold.,13-09-2023,4
228,485,Heavy others more none space fly it.,12-11-2024,2
229,192,Affect suggest floor get.,09-10-2024,0
230,,Number morning force.,07-11-2024,1
231,223,Feeling common use page detail.,06-01-2024,3
232,115,Rock agreement rate somebody table performance.,15-08-2024,0
233,396,Run chance doctor address.,31-05-2025,0
234,468,Third appear if board guy early.,19-03-2025,5
235,133,Fill look face brother movement hundred you turn.,01-01-2024,3
236,372,Improve day education run thing positive summer.,11-08-2024,5
237,,Travel no energy try according box need.,23-04-2025,3
238,336,Actually that book partner.,29-06-2025,0
239,74,Owner section maintain plant research sometimes.,20-12-2023,1
240,215,Evidence piece social themselves identify.,23-09-2023,0
241,437,Evening else who early yes.,02-02-2024,4
242,197,Site pattern design least reduce impact any other.,26-04-2024,3
243,13,Same myself hard police stuff radio exactly.,03-12-2023,0
244,46,Throw office data whose.,07-01-2024,5
245,4,Moment pick police value shake.,28-08-2024,1
246,369,,10-06-2024,4
247,321,Development cup risk former road alone.,21-11-2023,1
248,494,Lay old prove method born former.,21-11-2023,4
249,252,Figure at power really so task focus.,28-06-2025,1
250,133,Now win build keep.,28-12-2023,3
251,286,Service view success fight day.,23-05-2025,1
252,43,When interest identify.,10-03-2024,2
253,210,Consumer lead one material.,08-08-2024,2
254,84,Team position should report option help kitchen reality.,11-09-2024,1
255,388,Hundred specific whether property.,19-04-2024,5
256,348,Suddenly avoid more determine.,13-12-2023,0
257,235,Allow receive their just real.,06-11-2023,1
258,94,Help top mission attention role power the.,19-12-2024,4
259,2,Here probably exactly media.,28-08-2023,5
260,434,Line particularly pay interview nothing.,09-07-2025,5
261,415,,10-01-2024,1
262,180,Culture laugh cold.,07-06-2024,0
263,401,Billion task sing special billion go despite.,10-03-2024,6
264,79,Culture treatment risk across subject life.,25-06-2025,3
265,142,After between often baby.,27-04-2025,1
266,490,Fill set may hot.,19-04-2024,2
267,451,Even add those treatment example according.,12-03-2025,6
268,210,True computer economic practice face director.,31-08-2023,6
269,227,Attack read glass low city man never.,06-12-2024,3
270,433,Garden yard spend source charge experience.,06-01-2024,6
271,320,Pattern quality student play I.,24-08-2023,3
272,240,Around citizen whatever house.,16-02-2025,0
273,340,News wife us should rise.,15-08-2024,4
274,31,Community teacher professional keep enough month.,17-08-2023,4
275,186,Stop town heart animal go dark.,23-09-2023,0
276,,Technology performance blood economy able.,11-04-2024,1
277,478,Where step new professor.,26-01-2024,0
278,262,Campaign remember his find.,15-02-2024,5
279,290,Difference political for.,18-07-2024,3
280,155,,28-08-2024,6
281,65,Message area mention maintain six support.,NA,5
282,443,Responsibility generation part bring consumer.,08-08-2023,2
283,108,Certainly individual wind beyond base sister write product.,06-10-2024,0
284,158,Term health phone big understand popular artist be.,20-09-2023,4
285,450,Audience store current player myself.,25-05-2025,6
286,194,Likely remain enter thought property total.,31-10-2024,4
287,486,Explain safe add quickly family employee one upon.,15-04-2025,3
288,45,Sing positive care board those him.,05-10-2024,1
289,327,She there represent cultural.,01-01-2025,0
290,130,This activity stay item ten give.,12-05-2024,2
291,385,Let would life important still finally throughout whatever.,03-08-2024,5
292,183,Full support security computer despite.,21-07-2024,6
293,403,Fight together structure example something compare.,03-10-2024,0
294,497,,07-01-2025,6
295,354,Once them former just Congress professor.,05-01-2024,2
296,145,Produce reality their paper.,18-01-2025,5
297,46,Product spend party general.,19-09-2023,4
298,52,Great affect together will so space economic.,20-10-2024,3
299,314,Prove watch account treat dinner cause day.,18-06-2024,0
300,101,Surface condition heart with society.,05-01-2024,0
301,42,Full rest Democrat especially.,22-09-2024,2
302,238,Firm discussion arrive much.,27-04-2024,2
303,439,Possible during mission meeting.,15-06-2024,6
304,120,Reflect new above window.,18-11-2023,1
305,173,Go very democratic after entire mother.,29-10-2023,6
306,404,Buy issue within final.,04-12-2023,2
307,448,Thus attorney hit.,05-10-2024,4
308,413,Teach sense whose media article.,21-10-2024,6
309,34,Write small sort bring bar improve firm.,18-12-2024,0
310,142,Personal think everyone lot raise final hard.,27-04-2025,3
311,215,Age both person unit.,12-06-2024,0
312,208,Low street upon tell that.,17-06-2024,1
313,444,Simply child deal woman.,06-11-2024,5
314,178,Probably measure chance institution about.,05-04-2025,0
315,419,It it spend land.,25-09-2024,0
316,23,Economy know nor read.,20-07-2024,5
317,83,Activity reality training on drive begin successful sound.,03-05-2025,4
318,190,Feel experience interesting cell system.,10-01-2025,0
319,337,Later more deal pattern and only generation.,01-04-2025,6
320,43,,12-01-2024,2
321,96,Tend enter boy office wife.,14-06-2025,1
322,16,Agree each field.,22-04-2024,5
323,206,Through individual score door.,03-01-2025,2
324,313,System cup above future early senior small.,20-09-2023,4
325,271,Quickly environment real agency present central not.,31-05-2025,4
326,422,Possible style like wish performance suffer.,01-08-2024,4
327,255,Positive lot fire both call almost decade.,25-06-2024,4
328,366,Later free coach.,21-09-2023,1
329,447,Future culture force either it billion tax.,01-06-2025,5
330,28,Goal realize they.,26-09-2024,0
331,104,National far maintain among PM movement situation.,18-09-2023,4
332,358,Board agreement prevent sound picture seven.,01-10-2024,4
333,305,Must everybody practice must seven quickly.,09-08-2023,4
334,424,,18-01-2024,4
335,310,Teacher everyone style American which.,10-09-2024,1
336,26,Decision really parent.,08-12-2023,1
337,414,Fire if street allow.,28-02-2025,2
338,481,Likely offer painting environmental.,23-11-2024,3
339,,Federal question laugh political TV learn over.,25-10-2023,0
340,480,Tree history between phone choice life give.,24-06-2025,4
341,60,Support front provide per cultural too boy.,24-07-2023,2
342,385,Into with whom explain who.,04-03-2024,3
343,383,Everybody career consider world machine.,30-06-2024,2
344,422,Pm relationship difference.,27-06-2024,6
345,334,Investment rule within close.,24-08-2024,1
346,24,Such reason here agree course value.,28-04-2025,2
347,54,Rock single between resource.,11-07-2024,6
348,388,Source turn shoulder explain become cost.,17-06-2024,6
349,475,Hear draw drop light professional.,11-12-2023,6
350,482,Set whole summer treat agent war.,10-07-2024,2
351,367,Return director animal.,11-08-2024,2
352,385,Upon base most quickly able stuff administration.,NA,0
353,370,Base tax dog.,16-07-2023,0
354,51,,27-09-2023,2
355,146,Case stand market interest expect in.,15-03-2025,3
356,326,Bag evening cost seem mention.,03-08-2024,5
357,269,Political professional religious store level keep.,23-03-2025,5
358,187,Policy successful share kitchen room them.,03-04-2024,5
359,322,Economy true leader difficult save ask.,20-01-2025,1
360,106,No country claim window manage impact so example.,14-06-2025,1
361,175,Realize go tell book during.,NA,2
362,272,On ball case only point within.,03-07-2024,0
363,62,Seek among too perform interest.,20-09-2023,4
364,,Situation consumer field.,NA,4
365,286,Base husband picture economy cultural make role.,11-05-2025,5
366,445,,24-04-2024,2
367,268,Assume southern doctor medical go board.,09-01-2024,4
368,242,Catch figure effort.,26-06-2025,4
369,240,Including herself however building.,19-02-2024,3
370,29,Model picture drop require water follow.,14-02-2024,5
371,240,Season available test set job week.,05-09-2023,0
372,213,Especially teach war.,03-12-2024,1
373,15,,27-11-2024,1
374,263,,04-02-2025,4
375,316,As lose new current attention.,10-02-2024,6
376,428,,22-12-2023,4
377,458,Worker admit half light away particular.,20-05-2024,5
378,306,White after contain thus find.,13-01-2024,1
379,302,Do red east Mr eye dinner.,12-11-2024,3
380,197,Position member sell dream admit cost.,22-08-2023,2
381,252,During fill team even.,03-09-2024,0
382,275,Possible strategy stand three part dinner if.,10-01-2025,3
383,174,Sure could blood answer floor.,02-07-2025,3
384,21,Both itself year reflect.,12-02-2025,6
385,215,Law pretty another newspaper talk continue.,12-06-2024,4
386,55,Chair two hotel.,28-12-2023,1
387,4,Push book subject including send soldier style.,12-05-2024,3
388,147,Stay sense age mission significant apply.,27-01-2025,3
389,345,Agree event to analysis herself deal visit.,05-08-2023,1
390,282,Benefit law future garden knowledge dog effort.,08-09-2023,5
391,181,,09-09-2024,2
392,497,Reason tree everybody major door purpose hour.,11-08-2023,2
393,8,Shoulder boy pass federal.,29-04-2025,2
394,132,Edge sort forward water.,08-09-2023,6
395,151,Growth drive system dark citizen account.,22-01-2025,6
396,394,Play of kind decade.,30-12-2023,3
397,449,Seek third especially threat security fund.,03-01-2025,1
398,96,Issue tax conference free ability.,19-11-2024,4
399,423,Nearly history sound bar receive technology later.,12-08-2024,3
400,300,Audience make hot imagine begin eat election.,NA,6
401,,,21-04-2024,4
402,309,Wait series investment this year serve more require.,10-03-2024,3
403,196,,24-12-2023,4
404,434,Cold mean call able line that so.,10-07-2023,3
405,204,Hair standard doctor heavy.,27-05-2025,2
406,11,Defense little star ever.,30-01-2024,6
407,227,Old dark both whose.,10-12-2024,6
408,183,Nor meeting catch support spend partner politics.,23-03-2025,4
409,318,Boy book onto continue.,26-07-2023,6
410,126,Necessary report hotel church from never.,08-04-2025,1
411,469,Do include try almost visit yes environment.,25-05-2024,1
412,357,Will look camera yourself surface.,05-03-2025,5
413,450,Recognize art arrive service.,08-04-2024,4
414,46,Hand central suffer last floor always everyone.,17-11-2024,2
415,377,Control then structure soon.,20-07-2023,4
416,209,Wife free positive response.,18-03-2025,6
417,422,Type the cold since get thousand.,20-12-2024,2
418,38,,28-10-2023,4
419,,Adult language happen hard.,20-11-2024,2
420,112,Program laugh nation every voice summer hit toward.,27-10-2024,1
421,24,Wonder represent man each student opportunity remember choose.,17-04-2024,5
422,489,Official truth trip.,30-05-2025,5
423,268,Both cup time least us.,25-06-2025,6
424,458,Close pay else think.,21-10-2023,6
425,145,Head policy performance garden.,03-10-2023,3
426,360,Watch director indeed and.,NA,0
427,58,Quite reveal office help available story.,26-07-2023,0
428,444,Program yes young service mother.,27-08-2023,4
429,71,At boy animal data still cut identify.,06-04-2025,5
430,438,Surface baby speech senior though deep.,24-12-2023,0
431,34,Wall same pressure throughout happen.,22-09-2023,3
432,6,Including political owner partner attack indeed.,05-04-2025,3
433,55,Commercial month street assume affect stage.,25-05-2024,5
434,308,Design full report draw.,25-10-2023,6
435,39,,21-08-2024,2
436,162,,10-08-2024,0
437,24,Quality information husband language through collection likely.,21-01-2025,2
438,189,Break alone coach girl very.,03-10-2023,4
439,194,Never be by central state population country.,20-11-2024,0
440,187,Despite serious within quickly positive treat.,13-07-2023,4
441,366,Subject tough fire action I.,27-03-2024,4
442,199,Player poor water yourself.,02-09-2023,6
443,207,Front expect very themselves.,09-11-2024,3
444,126,Himself yes stand task effect president main.,19-06-2025,6
445,445,Give education film short newspaper.,07-08-2024,1
446,442,Ten executive five discover business maybe available.,31-12-2023,3
447,159,Happy base us itself baby.,29-03-2024,5
448,48,Here behind purpose anyone yet realize.,13-11-2024,1
449,,Quality ten ago south late form.,23-09-2023,1
450,,,11-11-2024,2
451,390,Soldier common mind.,23-05-2024,6
452,256,First race its him.,17-02-2025,6
453,394,From everything executive material someone ability painting.,14-07-2023,6
454,252,Friend food choose decide maintain find.,20-01-2024,5
455,414,Situation role say appear.,03-12-2024,3
456,218,,04-01-2025,1
457,63,Plan key east draw amount will.,01-03-2025,2
458,127,Total student administration for wish heart agency.,19-09-2024,0
459,165,Provide purpose off behavior hair act avoid rather.,09-01-2024,6
460,469,Staff this specific.,13-02-2025,3
461,71,Tv of fact bring role ready attack.,19-04-2024,3
462,40,Reflect fund space surface build memory.,12-10-2023,1
463,465,Growth should cause.,27-04-2025,0
464,414,Hour indicate method little box pattern audience.,18-09-2024,0
465,120,Coach president expect perform structure majority general.,09-10-2023,2
466,392,Energy amount it cell.,30-05-2024,6
467,260,Own soldier although conference body like computer.,19-05-2025,6
468,186,Factor act side image again mouth line.,29-03-2024,3
469,193,On fish buy local this.,29-05-2025,6
470,328,Level heavy almost day.,18-10-2024,3
471,,Camera give star dark born bar.,27-09-2023,0
472,307,Hand drive do.,01-08-2024,3
473,117,Indicate development true left mind enjoy investment mother.,14-11-2024,5
474,10,None new social southern opportunity join future contain.,26-06-2024,4
475,403,Make help deal first two.,06-11-2023,4
476,389,Market far figure until difference middle.,11-04-2024,2
477,190,,27-08-2023,2
478,217,Both student next PM hundred she professor.,25-11-2024,5
479,240,Character country along often thus medical.,31-07-2024,5
480,184,Thousand know maybe share here against throw chance.,02-01-2024,2
481,53,Something break town oil across data anything.,13-10-2023,5
482,,Tax national system crime least which.,01-09-2023,1
483,424,Whole each onto produce cultural argue table.,03-06-2024,3
